1)
create table postac (id_postaci int auto_increment, nazwa varchar(40), rodzaj enum('wiking','ptak','kobieta'), data_ur date, wiek tinyint, primary key (id_postaci));
Query OK, 0 rows affected (0.024 sec)

MariaDB [wikingowie]> show tables;
+----------------------+
| Tables_in_wikingowie |
+----------------------+
| postac               |
+----------------------+
1 row in set (0.001 sec)
MariaDB [wikingowie]> describe postac;
+------------+---------------------------------+------+-----+---------+----------------+
| Field      | Type                            | Null | Key | Default | Extra          |
+------------+---------------------------------+------+-----+---------+----------------+
| id_postaci | int(11)                         | NO   | PRI | NULL    | auto_increment |
| nazwa      | varchar(40)                     | YES  |     | NULL    |                |
| rodzaj     | enum('wiking','ptak','kobieta') | YES  |     | NULL    |                |
| data_ur    | date                            | YES  |     | NULL    |                |
| wiek       | tinyint(4)                      | YES  |     | NULL    |                |
+------------+---------------------------------+------+-----+---------+----------------+
5 rows in set (0.012 sec)

MariaDB [wikingowie]> insert into postac(nazwa,rodzaj,data_ur,wiek) values ('Bjorn','wiking',null,24),('Drozd','ptak',null,34),('Tesciowa','kobieta',null,null);
Query OK, 3 rows affected, 2 warnings (0.010 sec)

MariaDB [wikingowie]> select * from postac;
+------------+----------+---------+---------+------+
| id_postaci | nazwa    | rodzaj  | data_ur | wiek |
+------------+----------+---------+---------+------+
|          5 | Bjorn    | wiking  | NULL    |   24 |
|          6 | Drozd    | ptak    | NULL    |   34 |
|          7 | Tesciowa | kobieta | NULL    | NULL |
+------------+----------+---------+---------+------+
3 rows in set (0.001 sec)


MariaDB [wikingowie]> update postac set data_ur=19881112 where nazwa="Drozd" ;
Query OK, 1 row affected (0.009 sec)
Rows matched: 1  Changed: 1  Warnings: 0

MariaDB [wikingowie]> update postac set wiek=88 where nazwa="Tesciowa" ;
Query OK, 1 row affected (0.010 sec)
Rows matched: 1  Changed: 1  Warnings: 0

MariaDB [wikingowie]> select * from postac;
+------------+----------+---------+------------+------+
| id_postaci | nazwa    | rodzaj  | data_ur    | wiek |
+------------+----------+---------+------------+------+
|          5 | Bjorn    | wiking  | 1998-04-16 |   24 |
|          6 | Drozd    | ptak    | 1988-11-12 |   34 |
|          7 | Tesciowa | kobieta | 1942-11-12 |   88 |
+------------+----------+---------+------------+------+
3 rows in set (0.001 sec)

